id,text
1,"Onessia is a magical kingdom unlike any other, a land of wonder and harmony. Its skies are painted in hues of gold at dawn, and its rivers shimmer with a soft purple glow, a gift from the enchanted springs that flow beneath the land. Onessia is home to lush, sprawling forests teeming with vibrant wildlife, from singing birds with rainbow feathers to gentle deer with antlers that sparkle like crystal. The kingdoms population is small, inhabited by only six people, each contributing to the beauty and balance of this perfect world. Together, they live in peace, celebrating the magic that binds them to the land and to each other."
2,"Baron Matteo is a beloved figure in Onessia, residing in the grand capital city of Portnewia. Known for his warm smile and love of celebration, Baron Matteo hosts a grand festival every month in the city square. These festivals are a time of joy, where the streets are adorned with colorful banners, and the air is filled with the scent of sweet pastries and the sound of lively music. People from all corners of Onessia gather to dance, share stories, and marvel at the magical fireworks that light up the purple-tinted night sky."
3,"Knight Tomeo, another of Onessia’s three knights, is a master of the bow. His arrows fly true, guided by his sharp eye and steady hand. Tomeo is often found in the kingdom’s forests, practicing his craft and ensuring the safety of the woodland creatures. He has a deep connection with nature, and the animals seem to trust him instinctively. Tomeo’s calm demeanor and quiet strength make him a pillar of support for his fellow knights. He believes that precision and patience are the keys to success, both in battle and in life."
4,"Explorer Luca is a daring adventurer with an unquenchable thirst for discovery. He spends his days charting the uncharted, climbing the highest peaks of Onessia’s majestic mountains. These mountains, cloaked in mist and mystery, are said to hold secrets of ancient magic. Luca’s determination is unmatched, and he carries with him a journal filled with sketches and notes about his journeys. Though the climbs are treacherous, Luca’s cheerful spirit never wavers. He often says, The people of Onessia eagerly await his return from each expedition, eager to hear tales of his adventures."
5,"Knight Rileo is one of the three legendary knights of Onessia, known far and wide for his unmatched skill with a sword. Rileo is a protector of the kingdom, a steadfast guardian of its people and its magic. He trains tirelessly in the castle courtyard, his blade moving like a silver streak under the sun. Despite his formidable prowess, Rileo is kind-hearted and humble, always ready to lend a hand to those in need. Children in the kingdom look up to him as a hero, and he often takes time to teach them the basics of swordplay."
6,"Knight Ivy is the most enigmatic of the three knights, known for her mastery of a rare and wondrous magic called machine learning. With this magic, Ivy can predict the movements of her foes, analyze patterns in the kingdom’s defenses, and even teach the castle’s enchanted statues to sing. Her brilliance is matched only by her compassion, as she uses her magic to improve the lives of Onessia’s people. Ivy is often seen in the royal library, surrounded by glowing runes and ancient tomes, her mind always at work."
7,"Wizard Erlando is a whimsical figure who spends his days by the shimmering purple rivers of Onessia. With his flowing robes and a hat adorned with frog-shaped pins, Erlando is a master potion-maker and a friend to all creatures. He brews potions of all kinds, from healing elixirs to concoctions that make flowers bloom in an instant. The frogs of the river are his constant companions, and he feeds them with care, believing them to be the keepers of the river’s magic. Erlando’s laughter is as contagious as his potions are effective, and his presence brings a sense of wonder to all who meet him."